{
  "id": "box-offset-validation-v1",
  "type": "axis_aligned_box",
  "instruction": "Create exactly one axis-aligned valid closed solid box, 64 mm along world X, 36 mm along world Y, and 22 mm along world Z. Its minimum corner must be world (-110,45,-28) mm and its maximum corner (-46,81,-6) mm. Leave no other objects. Use the available RhinoMCP tools and verify the result.",
  "dimensions": [
    64,
    36,
    22
  ],
  "minimum": [
    -110,
    45,
    -28
  ],
  "units": "Millimeters",
  "linear_tolerance": 0.001,
  "volume_tolerance": 0.01
}
